{
  "$schema": "https://json-schema.org/draft/2020-12/schema",
  "$id": "urn:cognitura:schema:cognition:theme-closure:2.0.0",
  "title": "Cognitura ThemeClosure 2.0.0",
  "type": "object",
  "additionalProperties": false,
  "required": [
    "schemaVersion",
    "artifactId",
    "revisionId",
    "publicationState",
    "themeRef",
    "coreQuestions",
    "thesis",
    "moduleCooperation",
    "themeSpine",
    "criticalDistinctions",
    "boundaries",
    "relatedThemes",
    "sourceCoverage",
    "gaps"
  ],
  "properties": {
    "schemaVersion": {"$ref": "urn:cognitura:schema:cognition:common:2.0.0#/$defs/schemaVersion"},
    "artifactId": {"$ref": "urn:cognitura:schema:cognition:common:2.0.0#/$defs/artifactId"},
    "revisionId": {"$ref": "urn:cognitura:schema:cognition:common:2.0.0#/$defs/revisionId"},
    "publicationState": {"$ref": "urn:cognitura:schema:cognition:common:2.0.0#/$defs/publicationState"},
    "themeRef": {"$ref": "urn:cognitura:schema:cognition:common:2.0.0#/$defs/artifactRef"},
    "coreQuestions": {
      "type": "array",
      "minItems": 1,
      "maxItems": 3,
      "items": {"$ref": "urn:cognitura:schema:cognition:common:2.0.0#/$defs/nonBlankText"}
    },
    "thesis": {"type": "string"},
    "moduleCooperation": {
      "type": "array",
      "items": {"$ref": "#/$defs/moduleContribution"}
    },
    "themeSpine": {
      "type": "array",
      "items": {"$ref": "urn:cognitura:schema:cognition:common:2.0.0#/$defs/orderedArtifactStep"}
    },
    "criticalDistinctions": {
      "type": "array",
      "items": {"$ref": "urn:cognitura:schema:cognition:common:2.0.0#/$defs/evidenceStatement"}
    },
    "boundaries": {
      "type": "array",
      "items": {"$ref": "urn:cognitura:schema:cognition:common:2.0.0#/$defs/evidenceStatement"}
    },
    "relatedThemes": {
      "type": "array",
      "maxItems": 12,
      "items": {"$ref": "urn:cognitura:schema:cognition:common:2.0.0#/$defs/relation"}
    },
    "sourceCoverage": {"$ref": "urn:cognitura:schema:cognition:common:2.0.0#/$defs/sourceCoverage"},
    "gaps": {
      "type": "array",
      "items": {"$ref": "urn:cognitura:schema:cognition:common:2.0.0#/$defs/gap"}
    }
  },
  "if": {
    "properties": {"publicationState": {"const": "PUBLISHED"}},
    "required": ["publicationState"]
  },
  "then": {
    "properties": {
      "thesis": {"minLength": 1},
      "moduleCooperation": {"minItems": 1},
      "themeSpine": {"minItems": 1},
      "criticalDistinctions": {"minItems": 1},
      "boundaries": {"minItems": 1}
    }
  },
  "$defs": {
    "moduleContribution": {
      "type": "object",
      "additionalProperties": false,
      "required": ["moduleRef", "contribution", "sourceRefs"],
      "properties": {
        "moduleRef": {"$ref": "urn:cognitura:schema:cognition:common:2.0.0#/$defs/artifactRef"},
        "contribution": {"$ref": "urn:cognitura:schema:cognition:common:2.0.0#/$defs/nonBlankText"},
        "sourceRefs": {"$ref": "urn:cognitura:schema:cognition:common:2.0.0#/$defs/artifactRefArray"}
      }
    }
  }
}
